{
    "branch":  "dev",
    "invocation_id":  "invocation-claude-001",
    "candidate_commit":  "2222222222222222222222222222222222222222",
    "trigger_key":  "REVIEW_CLAUDE_LATEST_HANDOFF",
    "reviewer":  "chatgpt-baijin-reviewer",
    "created_at":  "2026-06-27T00:00:00.000Z",
    "exact_trigger_text":  "审查 Claude 最新交接",
    "repository":  "shunhang776/xinbaijin",
    "protocol":  "baijin-chatgpt-review-invocation/1.0"
}
