{
    "branch":  "dev",
    "invocation_id":  "invocation-mcp-001",
    "candidate_commit":  "1111111111111111111111111111111111111111",
    "trigger_key":  "REVIEW_MCP_LATEST_HANDOFF",
    "reviewer":  "chatgpt-baijin-reviewer",
    "created_at":  "2026-06-27T00:00:00.000Z",
    "exact_trigger_text":  "审查 MCP 最新交接",
    "repository":  "shunhang776/xinbaijin-mcp",
    "protocol":  "baijin-chatgpt-review-invocation/1.0"
}
